{
  "$schema": "https://registry.rackjs.com/schemas/preset.json",
  "name": "node-library",
  "version": "1.0.0",
  "description": "Publishable Node library scaffold: Rollup dual CJS/ESM build, Vitest tests, ESLint + Prettier, Husky + commitlint",
  "tags": ["node", "rollup", "vitest", "library", "typescript"],
  "registries": [
    "build/rollup",
    "runtimes/node",
    "runtimes/node-library",
    "build/typescript",
    "quality/vitest",
    "quality/husky",
    "quality/prettier",
    "quality/eslint",
    "quality/lint-staged",
    "quality/commitlint"
  ]
}
